<?xml version="1.0" encoding="UTF-8"?><nds xmlns:xsi="http://www.w3.org/2001/XMLSchema-instance" xsi:noNamespaceSchemaLocation="811_01.xsd" dtdversion="1.1" ndsversion="8.5">  <input>    <add class-name="User" src-dn="Anton Ebenhof" event-id="0">      <add-attr attr-name="Surname">        <value type="string">Ebenhof</value>      </add-attr>      <add-attr attr-name="Country">        <value type="string">DE</value>      </add-attr>      <add-attr attr-name="Location">        <value type="string">Essen</value>      </add-attr>      <add-attr attr-name="Telephone Number">        <value type="string">+49 201 5552-474</value>      </add-attr>    </add>  </input></nds>